trial,condition,structure,violation,congruency,interference,viol_loc,n1_number,n2_number,v1_number,n1,n2,v1,sentence,modality,probe_word,probe
trial_1,GDLD,lr_obj,yes,yes,yes,6.0,plur,plur,sing,champions,malades,élit,Les champions que ces malades élit mentent rarement.,visual,notaires,False
trial_2,GDLD,sr_pp,yes,yes,yes,6.0,sing,sing,plur,boucher,gardien,craignent,Loin du boucher ce gardien craignent ce notaire.,visual,du,True
trial_3,GSLD,lr_pp,no,no,yes,,sing,plur,sing,facteur,médecins,punit,Un facteur auprès des médecins punit un pompier.,visual,malade,False
trial_4,GSLD,lr_obj,yes,no,no,6.0,sing,plur,sing,facteur,marins,élit,Le facteur que les marins élit vomit partout.,visual,ces,False
trial_5,GDLS,lr_pp,yes,no,no,6.0,plur,sing,sing,chefs,dentiste,plaint,Des chefs auprès du dentiste plaint des soldats.,visual,chef,False
trial_6,GSLS,sr_pp,no,yes,no,,sing,sing,sing,juge,marin,punit,Près du juge un marin punit le vendeur.,visual,ce,False
trial_7,GDLS,lr_pp,yes,no,no,6.0,sing,plur,plur,comédien,facteurs,servent,Ce comédien proche des facteurs servent ce notaire.,visual,des,True
trial_8,GSLS,lr_pp,no,yes,no,,sing,sing,sing,médecin,patient,séduit,Un médecin auprès du patient séduit ce peintre.,visual,proche,False
trial_9,GDLD,lr_pp,yes,yes,yes,6.0,plur,plur,sing,bouchers,marchands,punit,Ces bouchers auprès des marchands punit les peintres.,visual,les,True
trial_10,GSLS,lr_obj,no,yes,no,,sing,sing,sing,malade,notaire,suit,Un malade que ce notaire suit ment souvent.,visual,malade,True
trial_11,GDLS,lr_obj,no,no,yes,,plur,sing,sing,facteurs,marin,séduit,Les facteurs que le marin séduit vomissent parfois.,visual,facteurs,True
trial_12,GDLD,lr_obj,yes,yes,yes,6.0,sing,sing,plur,juge,marchand,attendent,Ce juge que le marchand attendent repart dehors.,visual,attendent,True
trial_13,GSLD,lr_pp,no,no,yes,,plur,sing,plur,chefs,gardien,décrivent,Ces chefs loin du gardien décrivent des patients.,visual,loin,True
trial_14,GDLD,lr_pp,yes,yes,yes,6.0,sing,sing,plur,boucher,matelot,émeuvent,Le boucher près du matelot émeuvent le serveur.,visual,ce,False
trial_15,GDLD,sr_pp,yes,yes,yes,6.0,plur,plur,sing,comédiens,dentistes,sert,Auprès des comédiens des dentistes sert des matelots.,visual,Auprès,True
trial_16,GSLS,lr_pp,no,yes,no,,plur,plur,plur,bouchers,champions,punissent,Les bouchers loin des champions punissent les prêtres.,visual,Ces,False
trial_17,GSLS,lr_obj,no,yes,no,,plur,plur,plur,dentistes,facteurs,reçoivent,Ces dentistes que les facteurs reçoivent écrivent parfois.,visual,reçoivent,True
trial_18,GDLS,lr_obj,no,no,yes,,sing,plur,plur,chef,danseurs,reçoivent,Le chef que ces danseurs reçoivent répond aussitôt.,visual,reçoivent,True
trial_19,GSLD,lr_obj,yes,no,no,6.0,plur,sing,plur,gardiens,matelot,suivent,Les gardiens que ce matelot suivent écrivent toujours.,visual,danseurs,False
trial_20,GSLS,sr_pp,no,yes,no,,plur,plur,plur,médecins,plombiers,attendent,Proche des médecins les plombiers attendent ces pompiers.,visual,danseurs,False
trial_21,GDLD,sr_pp,yes,yes,yes,6.0,sing,sing,plur,gérant,plombier,défendent,Auprès du gérant le plombier défendent un prêtre.,auditory,ce,False
trial_22,GSLS,lr_obj,no,yes,no,,sing,sing,sing,chanteur,malade,défend,Le chanteur que ce malade défend doit partir.,auditory,champion,False
trial_23,GSLD,lr_pp,no,no,yes,,sing,plur,sing,libraire,patients,suit,Ce libraire proche des patients suit ce prêtre.,auditory,émeut,False
trial_24,GDLD,lr_obj,yes,yes,yes,6.0,sing,sing,plur,chanteur,libraire,servent,Un chanteur que le libraire servent doit manger.,auditory,Ce,False
trial_25,GDLS,lr_pp,yes,no,no,6.0,plur,sing,sing,marins,soldat,défend,Les marins loin du soldat défend des vendeurs.,auditory,plombier,False
trial_26,GSLS,lr_pp,no,yes,no,,sing,sing,sing,chanteur,dentiste,attend,Un chanteur près du dentiste attend le vendeur.,auditory,le,True
trial_27,GDLD,lr_pp,yes,yes,yes,6.0,plur,plur,sing,comédiens,libraires,plaint,Les comédiens proche des libraires plaint les matelots.,auditory,Les,True
trial_28,GSLD,lr_obj,yes,no,no,6.0,sing,plur,sing,client,pompiers,émeut,Un client que ces pompiers émeut répond aussitôt.,auditory,pompiers,True
trial_29,GDLS,lr_obj,no,no,yes,,plur,sing,sing,comédiens,serveur,attend,Les comédiens que le serveur attend répondent aussitôt.,auditory,loin,False
trial_30,GSLD,lr_obj,yes,no,no,6.0,plur,sing,plur,gardiens,libraire,haïssent,Les gardiens que ce libraire haïssent savent danser.,auditory,danser,True
trial_31,GDLD,lr_obj,yes,yes,yes,6.0,plur,plur,sing,chanteurs,facteurs,suit,Les chanteurs que les facteurs suit savent nager.,auditory,ces,False
trial_32,GDLS,lr_obj,no,no,yes,,sing,plur,plur,gardien,marins,décrivent,Le gardien que les marins décrivent répond lentement.,auditory,que,True
trial_33,GDLD,lr_pp,yes,yes,yes,6.0,sing,sing,plur,gardien,patient,reçoivent,Ce gardien loin du patient reçoivent le soldat.,auditory,Un,False
trial_34,GDLS,lr_pp,yes,no,no,6.0,sing,plur,plur,boucher,dentistes,émeuvent,Le boucher loin des dentistes émeuvent ce malade.,auditory,boucher,True
trial_35,GSLS,lr_pp,no,yes,no,,plur,plur,plur,facteurs,prêtres,attendent,Des facteurs proche des prêtres attendent les vendeurs.,auditory,séduisent,False
trial_36,GSLS,sr_pp,no,yes,no,,sing,sing,sing,dentiste,gérant,bénit,Proche du dentiste un gérant bénit le matelot.,auditory,Près,False
trial_37,GSLS,sr_pp,no,yes,no,,plur,plur,plur,chanteurs,danseurs,bénissent,Proche des chanteurs les danseurs bénissent les libraires.,auditory,les,True
trial_38,GSLS,lr_obj,no,yes,no,,plur,plur,plur,comédiens,danseurs,entendent,Les comédiens que ces danseurs entendent mentent toujours.,auditory,toujours,True
trial_39,GDLD,sr_pp,yes,yes,yes,6.0,plur,plur,sing,bouchers,dentistes,suit,Proche des bouchers ces dentistes suit des serveurs.,auditory,Proche,True
trial_40,GSLD,lr_pp,no,no,yes,,plur,sing,plur,champions,marin,séduisent,Ces champions proche du marin séduisent des soldats.,auditory,soldats,True
